{
  "document_id": "research.architecture.decoupled_microkernel_architecture.2026-08-17",
  "document_type": "research",
  "status": "RESEARCH",
  "title": "ADR-042: Arquitetura de Microkernel Desacoplado para o tare.tools Agent OS",
  "created_at": "2026-08-17T18:34:36.641050+00:00",
  "language": "en",
  "abstract": "Estudo formal de arquitetura para o tare.tools Agent OS.",
  "authors": [
    {
      "name": "Augusto Carvalho",
      "role": "author"
    },
    {
      "name": "Antigravity Mediator",
      "role": "agent"
    }
  ],
  "bounded_contexts": [
    "Harness Architecture",
    "Control Plane",
    "Governance / Audit",
    "Validation / Assurance"
  ],
  "provenance": {
    "origin": "ratified_tripartite_round_table",
    "translation_of": "research.architecture.decoupled_microkernel_architecture.2026-08-17",
    "source_file": "DECOUPLED_MICROKERNEL_ARCHITECTURE.md"
  }
}
